{
  "schema_version": 1,
  "id": "hanbali-default",
  "name": "Hanbali Default Rules",
  "madhab": "hanbali",
  "version": "1.0.0",
  "currency": "USD",
  "read_only_default": true,
  "nisab_basis": {
    "mode": "gold",
    "source": "Common contemporary Hanbali implementation"
  },
  "rates": {
    "zakat": 0.025
  },
  "asset_categories": [
    {
      "key": "cash",
      "label": "Cash and bank balances",
      "enabled": true,
      "rate_key": "zakat",
      "include_in_nisab": true
    },
    {
      "key": "gold_silver",
      "label": "Gold and silver",
      "enabled": true,
      "rate_key": "zakat",
      "include_in_nisab": true
    },
    {
      "key": "trade_inventory",
      "label": "Trade inventory",
      "enabled": true,
      "rate_key": "zakat",
      "include_in_nisab": true
    },
    {
      "key": "shares_for_trade",
      "label": "Trade-position shares",
      "enabled": true,
      "rate_key": "zakat",
      "include_in_nisab": true
    }
  ],
  "debts_policy": {
    "deduct_short_term": true,
    "deduct_long_term": false,
    "max_deduction_ratio": 1,
    "notes": "Debts due within current cycle can generally be deducted."
  },
  "exemptions": [
    "primary_residence",
    "personal_vehicle",
    "personal_use_items"
  ],
  "rounding_policy": {
    "mode": "nearest",
    "precision": 2
  },
  "metadata": {
    "region_hint": "global",
    "maintainer": "builtin"
  },
  "references": [
    {
      "title": "Al-Mughni by Ibn Qudamah (Hanbali reference)",
      "url": "https://archive.org/details/FP110916",
      "id": "hanbali-ref-1"
    },
    {
      "title": "AAOIFI Sharia Standard No. 35 (Zakah)",
      "url": "https://aaoifi.com/shariaa-standards/?lang=en",
      "id": "hanbali-ref-2"
    }
  ],
  "principles_scope": {
    "reviewed_against_references": true,
    "implemented": [
      "nisab_threshold_basis",
      "zakat_rate_2_5_percent",
      "eligible_assets_screening",
      "debt_deduction_policy",
      "exempt_personal_use_assets",
      "rounding_method",
      "receivables_treatment"
    ],
    "not_implemented": [
      "hawl_lunar_year"
    ],
    "notes": "This profile encodes quantitative calculation settings, but does not model all textual fiqh conditions; hawl lifecycle handling is expected at application/workflow level."
  },
  "automation_policy": {
    "mode": "manual",
    "unresolved_rule_policy": "warn"
  }
}
